{
  "schema_version": "0.1.0",
  "titulo": "Ciclo XX — Grama-Cortada: economia, memória e vida cotidiana",
  "estado": "worldbuilding_exploratorio_sem_canonizacao",
  "aprovacao_autoral": false,
  "aplicar_ao_canon_automaticamente": false,
  "territorio": "Condado de Grama-Cortada",
  "grupo_cultural": "Hobbits / Halflings",
  "referencia_id_regiao": null,
  "referencia_id_lugar": null,
  "lat_long_confirmados": null,
  "populacao_confirmada": null,
  "fonte_manuscrito": "fontes/autoria/hack-carcaca-dw-capitulo-i.paginas.json",
  "protagonista_cultural_documentado": "Menelau Folha-Seca",
  "politica_editorial": "Desenvolver a vida cultural e material do Condado por si mesma; não reduzi-la ao conflito da Corte ou homologar festividades, costumes e leis especulativos.",
  "fatos_documentados": [
    {
      "id": "worldbuilding-xx:fato:01",
      "pagina_manuscrito": 18,
      "afirmacao_de_fonte": "O povo hobbit é chamado de halfling por muitos estrangeiros, e Grama-Cortada aparece como Condado.",
      "estado": "manuscrito_em_revisao",
      "reformulacao_aprovada": false
    },
    {
      "id": "worldbuilding-xx:fato:02",
      "pagina_manuscrito": 18,
      "afirmacao_de_fonte": "Menelau Folha-Seca é citado como bardo autoproclamado de Grama-Cortada; o texto menciona seus 95 centímetros.",
      "estado": "manuscrito_em_revisao",
      "reformulacao_aprovada": false
    },
    {
      "id": "worldbuilding-xx:fato:03",
      "pagina_manuscrito": 18,
      "afirmacao_de_fonte": "O território é descrito por vilas, campos, bosques, propriedades familiares e estradas locais.",
      "estado": "manuscrito_em_revisao",
      "reformulacao_aprovada": false
    },
    {
      "id": "worldbuilding-xx:fato:04",
      "pagina_manuscrito": 18,
      "afirmacao_de_fonte": "Famílias e vizinhança são centrais e casas e terras tendem a manter associações com linhagens por gerações.",
      "estado": "manuscrito_em_revisao",
      "reformulacao_aprovada": false
    },
    {
      "id": "worldbuilding-xx:fato:05",
      "pagina_manuscrito": 18,
      "afirmacao_de_fonte": "O Condado não é um reino centralizado; não possui dinastia grande, castelos dominantes ou exército permanente.",
      "estado": "manuscrito_em_revisao",
      "reformulacao_aprovada": false
    },
    {
      "id": "worldbuilding-xx:fato:06",
      "pagina_manuscrito": 18,
      "afirmacao_de_fonte": "Anciãos, famílias e pessoas respeitadas podem influenciar sem títulos formais.",
      "estado": "manuscrito_em_revisao",
      "reformulacao_aprovada": false
    },
    {
      "id": "worldbuilding-xx:fato:07",
      "pagina_manuscrito": 19,
      "afirmacao_de_fonte": "Questões locais são resolvidas localmente; questões maiores exigem conversa entre comunidades.",
      "estado": "manuscrito_em_revisao",
      "reformulacao_aprovada": false
    },
    {
      "id": "worldbuilding-xx:fato:08",
      "pagina_manuscrito": 19,
      "afirmacao_de_fonte": "Comunidades usam agricultura variada, de raízes, cereais, ervas e frutas, e mantêm despensas.",
      "estado": "manuscrito_em_revisao",
      "reformulacao_aprovada": false
    },
    {
      "id": "worldbuilding-xx:fato:09",
      "pagina_manuscrito": 19,
      "afirmacao_de_fonte": "O manuscrito menciona campos, hortas, cervejas, tabacos e erva-de-hobbit.",
      "estado": "manuscrito_em_revisao",
      "reformulacao_aprovada": false
    },
    {
      "id": "worldbuilding-xx:fato:10",
      "pagina_manuscrito": 19,
      "afirmacao_de_fonte": "A transmissão oral de histórias, genealogias, receitas e acontecimentos é especialmente importante.",
      "estado": "manuscrito_em_revisao",
      "reformulacao_aprovada": false
    },
    {
      "id": "worldbuilding-xx:fato:11",
      "pagina_manuscrito": 19,
      "afirmacao_de_fonte": "A resistência à opressão aparece em ajuda discreta e acolhimento, sem que todos os hobbits sejam combatentes.",
      "estado": "manuscrito_em_revisao",
      "reformulacao_aprovada": false
    },
    {
      "id": "worldbuilding-xx:fato:12",
      "pagina_manuscrito": 19,
      "afirmacao_de_fonte": "A relativa autonomia de produção ajuda a resistir à interrupção de rotas de abastecimento.",
      "estado": "manuscrito_em_revisao",
      "reformulacao_aprovada": false
    }
  ],
  "limites": [
    "Grama-Cortada existe no manuscrito, mas não consta como região/lugar próprio no vocabulário geográfico atual; não inventar suas coordenadas.",
    "O Condado não é um reino nem uma burocracia única; não inventar conselhos, impostos, tribunais e representantes oficiais.",
    "Influência de anciãos e famílias não equivale a poder jurídico hereditário sem evidência.",
    "Descrever agricultura diversificada não implica safras, clima, variedades exclusivas, moeda ou volumes de comércio confirmados.",
    "Cultivo, cervejas, tabaco e erva-de-hobbit são citados; receitas, legislação, propriedade terapêutica e distribuição são desconhecidas.",
    "Menelau Folha-Seca existe na fonte, mas as cenas não registram apresentações, viagens ou aparições históricas reais.",
    "Oralidade é importante, mas não exclui a escrita nem torna todo relato verdadeiro.",
    "Não estabelecer deus, culto, festival, calendário, ofício regulamentado ou arquitetura única como característica universal do povo.",
    "O apoio a refugiados e o conflito com a Corte são aspectos da história, não a definição de toda a cultura hobbit.",
    "Conflitos propostos entre famílias são abstratos; não criar NPCs e linhagens canônicas nem fatos de campanha.",
    "Nenhuma vinheta ocorreu; todas são propostas ilustrativas.",
    "Não alterar regras de Dungeon World, criaturas, mapas ou o inventário de revisão XIX."
  ],
  "contagens": {
    "fatos": 12,
    "dominios_da_vida": 9,
    "circuitos_economicos": 5,
    "formas_de_convivencia": 4,
    "conflitos_internos": 5,
    "celebracoes_possiveis": 4,
    "generos_da_memoria": 4,
    "vinhetas": 4,
    "decisoes": 8
  },
  "dominios_da_vida": [
    {
      "id": "worldbuilding-xx:dominios_da_vida:terra-e-heranca",
      "nome_editorial": "Terra que lembra nomes",
      "hipotese_social": "A terra não precisa ser propriedade absoluta para ter raízes familiares; o cultivo e o uso por gerações podem gerar obrigações concorrentes.",
      "contradicao": "Quem decide sobre uma horta quando parentes mudam de casa, divergem ou retornam de longe?",
      "detalhe_de_cotidiano": "Uma criança aprende o nome antigo de cada canteiro; um parente não reconhece a divisão feita antes de seu nascimento.",
      "possibilidade_narrativa": "Uma venda de terra provoca discussão sobre a quem pertencem árvores e caminhos.",
      "estado": "exploracao_cultural_nao_canonica",
      "ocorreu": false,
      "instituicao_confirmada": false,
      "fonte_contexto_paginas": [
        19
      ],
      "nao_fixar": "Sem data, rito oficial, norma escrita, família inventada, rota, localidade ou economia quantificada."
    },
    {
      "id": "worldbuilding-xx:dominios_da_vida:arquitetura-domestica",
      "nome_editorial": "A porta vista da rua",
      "hipotese_social": "Casas podem refletir hospitalidade, privacidade, trabalho e espaço para parentes, sem impor a toca subterrânea como padrão universal.",
      "contradicao": "A ideia de casa aberta pode servir de pressão sobre famílias pobres ou que precisem de privacidade.",
      "detalhe_de_cotidiano": "Uma janela dá para uma horta; outra para onde os vizinhos sempre conversam.",
      "possibilidade_narrativa": "A visita inesperada revela diferenças entre convite e obrigação.",
      "estado": "exploracao_cultural_nao_canonica",
      "ocorreu": false,
      "instituicao_confirmada": false,
      "fonte_contexto_paginas": [
        19
      ],
      "nao_fixar": "Sem data, rito oficial, norma escrita, família inventada, rota, localidade ou economia quantificada."
    },
    {
      "id": "worldbuilding-xx:dominios_da_vida:mesa-e-prestigio",
      "nome_editorial": "Quem senta à mesa",
      "hipotese_social": "As refeições podem funcionar como lugares de mediação, memória e disputa, para além do prazer de comer.",
      "contradicao": "A pessoa que cozinha e serve também tem voz quando decisões são tomadas à mesa?",
      "detalhe_de_cotidiano": "Em uma conversa difícil, o pão acaba antes do assunto.",
      "possibilidade_narrativa": "Uma refeição de família decide silenciosamente quem será ouvido.",
      "estado": "exploracao_cultural_nao_canonica",
      "ocorreu": false,
      "instituicao_confirmada": false,
      "fonte_contexto_paginas": [
        19
      ],
      "nao_fixar": "Sem data, rito oficial, norma escrita, família inventada, rota, localidade ou economia quantificada."
    },
    {
      "id": "worldbuilding-xx:dominios_da_vida:trabalho-interdependente",
      "nome_editorial": "O serviço que ninguém anuncia",
      "hipotese_social": "Agricultura mista cria dependência entre quem planta, colhe, cozinha, fabrica recipientes e transporta mercadorias.",
      "contradicao": "O valor social de um trabalho é medido pelo preço, pelo prestígio da família ou por sua utilidade?",
      "detalhe_de_cotidiano": "Um pote rachado traz mais preocupação que um boato de rei distante.",
      "possibilidade_narrativa": "Uma disputa pelo pagamento de reparos atravessa várias casas.",
      "estado": "exploracao_cultural_nao_canonica",
      "ocorreu": false,
      "instituicao_confirmada": false,
      "fonte_contexto_paginas": [
        19
      ],
      "nao_fixar": "Sem data, rito oficial, norma escrita, família inventada, rota, localidade ou economia quantificada."
    },
    {
      "id": "worldbuilding-xx:dominios_da_vida:infancia-e-autonomia",
      "nome_editorial": "Crianças, perguntas e caminhos",
      "hipotese_social": "Uma criança pode aprender cantigas, histórias de famílias, cultivo e prudência comunitária, sem destino profissional imposto.",